{
  "nom": "example_login",
  "description": "Example scenario — log in to an app and capture the result",
  "url": "https://your-app.local/",
  "actions": [
    {
      "type": "remplir_som",
      "id": 1,
      "valeur": "depuis_secrets",
      "secret_cle": "password"
    },
    {
      "type": "cliquer_som",
      "id": 2
    },
    {
      "type": "capturer",
      "nom": "after_login"
    }
  ]
}
